{
  "$otSharedSchema": "#/pipette/schemas/2/pipetteLiquidPropertiesSchema.json",
  "supportedTips": {
    "t1000": {
      "defaultAspirateFlowRate": {
        "default": 274.7,
        "valuesByApiLevel": { "2.0": 137.35, "2.6": 274.7 }
      },
      "defaultDispenseFlowRate": {
        "default": 274.7,
        "valuesByApiLevel": { "2.0": 137.35, "2.6": 274.7 }
      },
      "defaultBlowOutFlowRate": {
        "default": 274.7,
        "valuesByApiLevel": { "2.0": 137.35, "2.6": 274.7 }
      },
      "defaultTipLength": 78.3,
      "defaultReturnTipHeight": 0.83,
      "aspirate": {
        "default": {
          "1": [
            [83.6, 0.01502, 25.62],
            [90.39, 0.0152, 24.45],
            [104.1, 0.01386, 24.57],
            [117.7, 0.00991, 24.98],
            [131.3, 0.007542, 25.26],
            [158.6, 0.006723, 25.37],
            [186.1, 0.005602, 25.55],
            [199.9, 0.005013, 25.66],
            [213.6, 0.002767, 26.11],
            [241.2, 0.003594, 25.93],
            [268.6, 0.002371, 26.22],
            [323.5, 0.001687, 26.41],
            [378.3, 0.001273, 26.54],
            [433.3, 0.001039, 26.63],
            [460.8, 0.0007889, 26.74],
            [488.1, 0.0004039, 26.92],
            [515.5, 0.0005667, 26.84],
            [542.9, 0.0005983, 26.82],
            [570.4, 0.0006121, 26.81],
            [597.7, 0.0002485, 27.02],
            [625.4, 0.0008384, 26.67],
            [652.5, -0.0001662, 27.3],
            [707.4, 0.0003177, 26.98],
            [762.4, 0.000383, 26.94],
            [817.1, 0.0001665, 27.1],
            [872.1, 0.000301, 26.99],
            [927.0, 0.0002205, 27.06],
            [981.8, 0.0001571, 27.12],
            [1010.0, 0.0003381, 26.94]
          ]
        }
      },
      "dispense": {
        "default": {
          "1": [
            [83.6, 0.01502, 25.62],
            [90.39, 0.0152, 24.45],
            [104.1, 0.01386, 24.57],
            [117.7, 0.00991, 24.98],
            [131.3, 0.007542, 25.26],
            [158.6, 0.006723, 25.37],
            [186.1, 0.005602, 25.55],
            [199.9, 0.005013, 25.66],
            [213.6, 0.002767, 26.11],
            [241.2, 0.003594, 25.93],
            [268.6, 0.002371, 26.22],
            [323.5, 0.001687, 26.41],
            [378.3, 0.001273, 26.54],
            [433.3, 0.001039, 26.63],
            [460.8, 0.0007889, 26.74],
            [488.1, 0.0004039, 26.92],
            [515.5, 0.0005667, 26.84],
            [542.9, 0.0005983, 26.82],
            [570.4, 0.0006121, 26.81],
            [597.7, 0.0002485, 27.02],
            [625.4, 0.0008384, 26.67],
            [652.5, -0.0001662, 27.3],
            [707.4, 0.0003177, 26.98],
            [762.4, 0.000383, 26.94],
            [817.1, 0.0001665, 27.1],
            [872.1, 0.000301, 26.99],
            [927.0, 0.0002205, 27.06],
            [981.8, 0.0001571, 27.12],
            [1010.0, 0.0003381, 26.94]
          ]
        }
      },
      "defaultPushOutVolume": 0
    }
  },
  "defaultTipOverlapDictionary": {
    "default": 9.7,
    "opentrons/opentrons_96_tiprack_1000ul/1": 11.5,
    "opentrons/opentrons_96_filtertiprack_1000ul/1": 11.5,
    "opentrons/geb_96_tiprack_1000ul/1": 9.5
  },
  "maxVolume": 1000,
  "minVolume": 100.0,
  "defaultTipracks": [
    "opentrons/opentrons_96_tiprack_1000ul/1",
    "opentrons/opentrons_96_filtertiprack_1000ul/1",
    "opentrons/geb_96_tiprack_1000ul/1"
  ]
}
