{
  "$otSharedSchema": "#/pipette/schemas/2/pipetteLiquidPropertiesSchema.json",
  "supportedTips": {
    "t50": {
      "defaultAspirateFlowRate": {
        "default": 8,
        "valuesByApiLevel": { "2.14": 8 }
      },
      "defaultDispenseFlowRate": {
        "default": 8,
        "valuesByApiLevel": { "2.14": 8 }
      },
      "defaultBlowOutFlowRate": {
        "default": 4,
        "valuesByApiLevel": { "2.14": 4 }
      },
      "defaultFlowAcceleration": 1200.0,
      "defaultTipLength": 57.9,
      "defaultReturnTipHeight": 0.71,
      "aspirate": {
        "default": {
          "1": [
            [0.6464, 0.4817, 0.0427],
            [1.0889, 0.2539, 0.1591],
            [1.5136, 0.1624, 0.2587],
            [1.9108, 0.1042, 0.3467],
            [2.2941, 0.0719, 0.4085],
            [2.9978, 0.037, 0.4886],
            [3.7731, 0.0378, 0.4863],
            [4.7575, 0.0516, 0.4342],
            [5.5024, 0.011, 0.6275],
            [6.2686, 0.0114, 0.6253],
            [7.005, 0.0054, 0.6625],
            [8.5207, 0.0063, 0.6563],
            [10.0034, 0.003, 0.6844],
            [11.5075, 0.0031, 0.6833],
            [13.0327, 0.0032, 0.6829],
            [14.5356, 0.0018, 0.7003],
            [17.5447, 0.0014, 0.7063],
            [20.5576, 0.0011, 0.7126],
            [23.5624, 0.0007, 0.7197],
            [26.5785, 0.0007, 0.721],
            [29.593, 0.0005, 0.7248],
            [32.6109, 0.0004, 0.7268],
            [35.6384, 0.0004, 0.727],
            [38.6439, 0.0002, 0.7343],
            [41.6815, 0.0004, 0.7284],
            [44.6895, 0.0002, 0.7372],
            [47.6926, 0.0001, 0.7393],
            [51.4567, 0.0001, 0.7382]
          ]
        }
      },
      "dispense": {
        "default": {
          "1": [
            [0.6464, 0.4817, 0.0427],
            [1.0889, 0.2539, 0.1591],
            [1.5136, 0.1624, 0.2587],
            [1.9108, 0.1042, 0.3467],
            [2.2941, 0.0719, 0.4085],
            [2.9978, 0.037, 0.4886],
            [3.7731, 0.0378, 0.4863],
            [4.7575, 0.0516, 0.4342],
            [5.5024, 0.011, 0.6275],
            [6.2686, 0.0114, 0.6253],
            [7.005, 0.0054, 0.6625],
            [8.5207, 0.0063, 0.6563],
            [10.0034, 0.003, 0.6844],
            [11.5075, 0.0031, 0.6833],
            [13.0327, 0.0032, 0.6829],
            [14.5356, 0.0018, 0.7003],
            [17.5447, 0.0014, 0.7063],
            [20.5576, 0.0011, 0.7126],
            [23.5624, 0.0007, 0.7197],
            [26.5785, 0.0007, 0.721],
            [29.593, 0.0005, 0.7248],
            [32.6109, 0.0004, 0.7268],
            [35.6384, 0.0004, 0.727],
            [38.6439, 0.0002, 0.7343],
            [41.6815, 0.0004, 0.7284],
            [44.6895, 0.0002, 0.7372],
            [47.6926, 0.0001, 0.7393],
            [51.4567, 0.0001, 0.7382]
          ]
        }
      },
      "defaultPushOutVolume": 2
    }
  },
  "defaultTipOverlapDictionary": {
    "default": 10.5,
    "opentrons/opentrons_flex_96_tiprack_50ul/1": 10.5
  },
  "maxVolume": 50,
  "minVolume": 5,
  "defaultTipracks": ["opentrons/opentrons_flex_96_tiprack_50ul/1"]
}
