{
  "$otSharedSchema": "#/pipette/schemas/2/pipetteLiquidPropertiesSchema.json",
  "supportedTips": {
    "t20": {
      "defaultAspirateFlowRate": {
        "default": 3.78,
        "valuesByApiLevel": { "2.0": 3.78, "2.6": 7.56 }
      },
      "defaultDispenseFlowRate": {
        "default": 3.78,
        "valuesByApiLevel": { "2.0": 3.78, "2.6": 7.56 }
      },
      "defaultBlowOutFlowRate": {
        "default": 3.78,
        "valuesByApiLevel": { "2.0": 3.78, "2.6": 7.56 }
      },
      "defaultTipLength": 31.15,
      "aspirate": {
        "opentrons/opentrons_96_tiprack_20ul/1": [
          [0.9034, 0.147, 0.6223],
          [1.0379, 0.0252, 0.6226],
          [1.1913, 0.0856, 0.5599],
          [1.3481, 0.078, 0.569],
          [1.5008, 0.0533, 0.6023],
          [1.6468, 0.0272, 0.6414],
          [1.7939, 0.0259, 0.6435],
          [1.9416, 0.0235, 0.6479],
          [2.0951, 0.0321, 0.6311],
          [2.4797, 0.0263, 0.6433],
          [2.8632, 0.0191, 0.6611],
          [3.2394, 0.0108, 0.6849],
          [3.6157, 0.0087, 0.6918],
          [3.9974, 0.0096, 0.6883],
          [4.3741, 0.0059, 0.7033],
          [4.7578, 0.0077, 0.6954],
          [5.1419, 0.0067, 0.6999],
          [5.9051, 0.0047, 0.7105],
          [7.4406, 0.0039, 0.7154],
          [8.9842, 0.003, 0.7218],
          [10.5104, 0.0014, 0.7366],
          [12.0673, 0.0022, 0.7274],
          [13.6096, 0.0012, 0.7395],
          [15.1334, 0.0004, 0.7509],
          [16.6911, 0.0013, 0.7371],
          [18.2255, 0.0005, 0.751],
          [19.7847, 0.001, 0.7412],
          [21.3395, 0.0008, 0.746]
        ],
        "default": {
          "1": [
            [0.9034, 0.147, 0.6223],
            [1.0379, 0.0252, 0.6226],
            [1.1913, 0.0856, 0.5599],
            [1.3481, 0.078, 0.569],
            [1.5008, 0.0533, 0.6023],
            [1.6468, 0.0272, 0.6414],
            [1.7939, 0.0259, 0.6435],
            [1.9416, 0.0235, 0.6479],
            [2.0951, 0.0321, 0.6311],
            [2.4797, 0.0263, 0.6433],
            [2.8632, 0.0191, 0.6611],
            [3.2394, 0.0108, 0.6849],
            [3.6157, 0.0087, 0.6918],
            [3.9974, 0.0096, 0.6883],
            [4.3741, 0.0059, 0.7033],
            [4.7578, 0.0077, 0.6954],
            [5.1419, 0.0067, 0.6999],
            [5.9051, 0.0047, 0.7105],
            [7.4406, 0.0039, 0.7154],
            [8.9842, 0.003, 0.7218],
            [10.5104, 0.0014, 0.7366],
            [12.0673, 0.0022, 0.7274],
            [13.6096, 0.0012, 0.7395],
            [15.1334, 0.0004, 0.7509],
            [16.6911, 0.0013, 0.7371],
            [18.2255, 0.0005, 0.751],
            [19.7847, 0.001, 0.7412],
            [21.3395, 0.0008, 0.746]
          ]
        }
      },
      "dispense": {
        "opentrons/opentrons_96_tiprack_20ul/1": [
          [0.9034, 0.147, 0.6223],
          [1.0379, 0.0252, 0.6226],
          [1.1913, 0.0856, 0.5599],
          [1.3481, 0.078, 0.569],
          [1.5008, 0.0533, 0.6023],
          [1.6468, 0.0272, 0.6414],
          [1.7939, 0.0259, 0.6435],
          [1.9416, 0.0235, 0.6479],
          [2.0951, 0.0321, 0.6311],
          [2.4797, 0.0263, 0.6433],
          [2.8632, 0.0191, 0.6611],
          [3.2394, 0.0108, 0.6849],
          [3.6157, 0.0087, 0.6918],
          [3.9974, 0.0096, 0.6883],
          [4.3741, 0.0059, 0.7033],
          [4.7578, 0.0077, 0.6954],
          [5.1419, 0.0067, 0.6999],
          [5.9051, 0.0047, 0.7105],
          [7.4406, 0.0039, 0.7154],
          [8.9842, 0.003, 0.7218],
          [10.5104, 0.0014, 0.7366],
          [12.0673, 0.0022, 0.7274],
          [13.6096, 0.0012, 0.7395],
          [15.1334, 0.0004, 0.7509],
          [16.6911, 0.0013, 0.7371],
          [18.2255, 0.0005, 0.751],
          [19.7847, 0.001, 0.7412],
          [21.3395, 0.0008, 0.746]
        ],
        "default": {
          "1": [
            [0.9034, 0.147, 0.6223],
            [1.0379, 0.0252, 0.6226],
            [1.1913, 0.0856, 0.5599],
            [1.3481, 0.078, 0.569],
            [1.5008, 0.0533, 0.6023],
            [1.6468, 0.0272, 0.6414],
            [1.7939, 0.0259, 0.6435],
            [1.9416, 0.0235, 0.6479],
            [2.0951, 0.0321, 0.6311],
            [2.4797, 0.0263, 0.6433],
            [2.8632, 0.0191, 0.6611],
            [3.2394, 0.0108, 0.6849],
            [3.6157, 0.0087, 0.6918],
            [3.9974, 0.0096, 0.6883],
            [4.3741, 0.0059, 0.7033],
            [4.7578, 0.0077, 0.6954],
            [5.1419, 0.0067, 0.6999],
            [5.9051, 0.0047, 0.7105],
            [7.4406, 0.0039, 0.7154],
            [8.9842, 0.003, 0.7218],
            [10.5104, 0.0014, 0.7366],
            [12.0673, 0.0022, 0.7274],
            [13.6096, 0.0012, 0.7395],
            [15.1334, 0.0004, 0.7509],
            [16.6911, 0.0013, 0.7371],
            [18.2255, 0.0005, 0.751],
            [19.7847, 0.001, 0.7412],
            [21.3395, 0.0008, 0.746]
          ]
        }
      },
      "defaultPushOutVolume": 0
    },
    "t10": {
      "defaultAspirateFlowRate": {
        "default": 3.78,
        "valuesByApiLevel": { "2.0": 3.78, "2.6": 7.56 }
      },
      "defaultDispenseFlowRate": {
        "default": 3.78,
        "valuesByApiLevel": { "2.0": 3.78, "2.6": 7.56 }
      },
      "defaultBlowOutFlowRate": {
        "default": 3.78,
        "valuesByApiLevel": { "2.0": 3.78, "2.6": 7.56 }
      },
      "defaultTipLength": 31.15,
      "aspirate": {
        "default": {
          "1": [
            [0.9034, 0.147, 0.6223],
            [1.0379, 0.0252, 0.6226],
            [1.1913, 0.0856, 0.5599],
            [1.3481, 0.078, 0.569],
            [1.5008, 0.0533, 0.6023],
            [1.6468, 0.0272, 0.6414],
            [1.7939, 0.0259, 0.6435],
            [1.9416, 0.0235, 0.6479],
            [2.0951, 0.0321, 0.6311],
            [2.4797, 0.0263, 0.6433],
            [2.8632, 0.0191, 0.6611],
            [3.2394, 0.0108, 0.6849],
            [3.6157, 0.0087, 0.6918],
            [3.9974, 0.0096, 0.6883],
            [4.3741, 0.0059, 0.7033],
            [4.7578, 0.0077, 0.6954],
            [5.1419, 0.0067, 0.6999],
            [5.9051, 0.0047, 0.7105],
            [7.4406, 0.0039, 0.7154],
            [8.9842, 0.003, 0.7218],
            [10.5104, 0.0014, 0.7366],
            [12.0673, 0.0022, 0.7274],
            [13.6096, 0.0012, 0.7395],
            [15.1334, 0.0004, 0.7509],
            [16.6911, 0.0013, 0.7371],
            [18.2255, 0.0005, 0.751],
            [19.7847, 0.001, 0.7412],
            [21.3395, 0.0008, 0.746]
          ]
        }
      },
      "dispense": {
        "default": {
          "1": [
            [0.9034, 0.147, 0.6223],
            [1.0379, 0.0252, 0.6226],
            [1.1913, 0.0856, 0.5599],
            [1.3481, 0.078, 0.569],
            [1.5008, 0.0533, 0.6023],
            [1.6468, 0.0272, 0.6414],
            [1.7939, 0.0259, 0.6435],
            [1.9416, 0.0235, 0.6479],
            [2.0951, 0.0321, 0.6311],
            [2.4797, 0.0263, 0.6433],
            [2.8632, 0.0191, 0.6611],
            [3.2394, 0.0108, 0.6849],
            [3.6157, 0.0087, 0.6918],
            [3.9974, 0.0096, 0.6883],
            [4.3741, 0.0059, 0.7033],
            [4.7578, 0.0077, 0.6954],
            [5.1419, 0.0067, 0.6999],
            [5.9051, 0.0047, 0.7105],
            [7.4406, 0.0039, 0.7154],
            [8.9842, 0.003, 0.7218],
            [10.5104, 0.0014, 0.7366],
            [12.0673, 0.0022, 0.7274],
            [13.6096, 0.0012, 0.7395],
            [15.1334, 0.0004, 0.7509],
            [16.6911, 0.0013, 0.7371],
            [18.2255, 0.0005, 0.751],
            [19.7847, 0.001, 0.7412],
            [21.3395, 0.0008, 0.746]
          ]
        }
      },
      "defaultPushOutVolume": 0
    }
  },
  "maxVolume": 20,
  "minVolume": 1.0,
  "defaultTipOverlapDictionary": {
    "default": 8.25,
    "opentrons/opentrons_96_tiprack_10ul/1": 8.25,
    "opentrons/opentrons_96_filtertiprack_10ul/1": 8.25,
    "opentrons/eppendorf_96_tiprack_10ul_eptips/1": 8.4,
    "opentrons/geb_96_tiprack_10ul/1": 8.3,
    "opentrons/opentrons_96_tiprack_20ul/1": 8.25,
    "opentrons/opentrons_96_filtertiprack_20ul/1": 8.25
  },
  "defaultTipracks": [
    "opentrons/opentrons_96_tiprack_20ul/1",
    "opentrons/opentrons_96_filtertiprack_20ul/1",
    "opentrons/opentrons_96_tiprack_10ul/1",
    "opentrons/opentrons_96_filtertiprack_10ul/1",
    "opentrons/geb_96_tiprack_10ul/1"
  ]
}
